Name,Address,Tax_Code,Province_Code,Province
HTX TAXI  Nha Trang,"Địa chỉ: 71A Phú Trung, Vĩnh Thạnh,, Thành phố Nha Trang, Khánh Hòa",Mã số thuế: 4200322675 - Đại diện pháp luật: Ngô Văn Lợi,KH,Khánh Hòa
 TP Hồ Chí Minh  01/12/1998,"Địa chỉ: Số 89, Đường Cách Mạng Tháng Tám, Phường Bến Thành, Quận 1, TP Hồ Chí Minh","Địa chỉ: Số 89, Đường Cách Mạng Tháng Tám, Phường Bến Thành, Quận 1, TP Hồ Chí Minh",Công Ty Taxi Việt Nam,Tp Hcm
Công Ty TNHH Hoàng Kim Taxi,"Địa chỉ: ấp 1 (thửa đất số 26,27,28; tờ bản đồ số 12), Xã Hữu Định, Huyện Châu Thành, Bến Tre",Mã số thuế: 1300491801 - Đại diện pháp luật: Võ Thị Xuân Lan,BT,Bến Tre
CÔNG TY TNHH HOÀI BÃO CHI NHÁNH TAXI TÂY NGUYÊN,"Địa chỉ: Số 57 đường Hùng Vương, Tổ dân phố 3, P.An Lạc, Phường An Lạc, Thị xã Buôn Hồ, Đắk Lắk",Mã số thuế: 6001185499-001 - Đại diện pháp luật: Đặng Anh Hoài,ĐL,Đắk Lắk
 Bắc Ninh  05/03/2015,"Địa chỉ: (NR: ông Trần Văn Tại), thôn Phủ, Xã Ninh Xá, Huyện Thuận Thành, Bắc Ninh","Địa chỉ: (NR: ông Trần Văn Tại), thôn Phủ, Xã Ninh Xá, Huyện Thuận Thành, Bắc Ninh",Công Ty Cổ Phần Taxi Lan Anh,Bắc Ninh
CÔNG TY CỔ PHẦN VẬN TẢI TAXI NỮ,"Địa chỉ: Tầng 2 ô 13, Lô 1, Đền Lừ 1, P.Hoàng Văn Thụ, Quận Hoàng Mai, Hà Nội",Mã số thuế: 0102346039 - Đại diện pháp luật: Đỗ Thu Hà,HN,Hà Nội
Bảo Việt Taxi - Chi Nhánh Công Ty Cổ Phần Thương Mại Bmv,"Địa chỉ: Số 20, ngõ 408, đường Xuân Đỉnh, Phường Xuân Đỉnh, Quận Bắc Từ Liêm, Hà Nội",Mã số thuế: 0101617462-003 - Đại diện pháp luật: Nguyễn Văn Trực,HN,Hà Nội
CHI NHÁNH CÔNG TY CỔ PHẦN SUN TAXI TẠI THÀNH PHỐ HẢI PHÒNG,"Địa chỉ: Số G70 khu biệt thự Mê Linh, Phường Anh Dũng, Quận Dương Kinh, Hải Phòng",Mã số thuế: 4201601110-012 - Đại diện pháp luật: Vũ Văn Việt,HP,Hải Phòng
CÔNG TY TNHH MTV DỊCH VỤ CHẤT LƯỢNG CAO TAXI TẢI 666,"Địa chỉ: 672/19 Trần Cao Vân, Phường Xuân Hà, Quận Thanh Khê, Đà Nẵng",Mã số thuế: 0401884204 - Đại diện pháp luật: Đinh Phú Hát,ĐN,Đà Nẵng
Công Ty Trách Nhiệm Hữu Hạn Một Thành Viên Taxi Tân Lạc,"Địa chỉ: Nhà ông Bùi Thành Quang, Khu 3, Thị trấn Mường Khến, Huyện Tân Lạc, Hòa Bình",Mã số thuế: 5400426472 - Đại diện pháp luật: Bùi Thành Quang,HB,Hòa Bình
Công Ty CP Vận Tải Taxi Hoành Sơn,"Địa chỉ: Tiểu Khu 1, Khu phố 1, Phường Sông Trí, Thị xã Kỳ Anh, Hà Tĩnh",Mã số thuế: 3001511186 - Đại diện pháp luật: Hồ Song Hào,HT,Hà Tĩnh
Công Ty TNHH 1 Tv Taxi Tải Hạ Long,"Địa chỉ: Tổ 2, khu 2, Phường Yết Kiêu, Thành phố Hạ Long, Quảng Ninh",Mã số thuế: 5701453261 - Đại diện pháp luật: Đỗ Quang Bắc,QN,Quảng Ninh
 TP Hồ Chí Minh  27/02/2023,"Địa chỉ: 233 Đặng Thùy Trâm, Phường 13, Quận Bình Thạnh, TP Hồ Chí Minh","Địa chỉ: 233 Đặng Thùy Trâm, Phường 13, Quận Bình Thạnh, TP Hồ Chí Minh",CÔNG TY TNHH DỊCH VỤ DU LỊCH GOTAXICAR,Tp Hcm
 Khánh Hòa  21/05/2010,"Địa chỉ: 11C Trần Phú, Phường Vĩnh Nguyên, Thành phố Nha Trang, Khánh Hòa","Địa chỉ: 11C Trần Phú, Phường Vĩnh Nguyên, Thành phố Nha Trang, Khánh Hòa",Hợp Tác Xã Taxi Phước Hùng,Khánh Hòa
Công ty Cổ Phần TAXI Phú Thuỵ,"Địa chỉ: Số 274, chợ Đường Cái, xã Đình Dù,, Huyện Văn Lâm, Hưng Yên",Mã số thuế: 0900282276 - Đại diện pháp luật: Phùng Thị Hương,HY,Hưng Yên
Chi Nhánh Công Ty TNHH Tm&Dv Taxi Trường Hải - Lạng Sơn,"Địa chỉ: Thôn Sơn Tây, Xã Yên Vượng, Huyện Hữu Lũng, Lạng Sơn",Mã số thuế: 2400769072-001 - Đại diện pháp luật: Nguyễn Mạnh Giang,LS,Lạng Sơn
CHI NHÁNH CÔNG TY CỔ PHẦN PHÚ MỸ - TRUNG TÂM ĐIỀU HÀNH TAXI,"Địa chỉ: Số 02/5 Đường Thành, tổ 1, Thị trấn Đông Hưng, Huyện Đông Hưng, Thái Bình",Mã số thuế: 1000395945-001 - Đại diện pháp luật: Lưu Ngọc Thuân,TB,Thái Bình
CÔNG TY TNHH TAXI ĐỒNG NAI,"Địa chỉ: Số 66/38/39, đường Bùi Trọng nghĩa, tổ 23, KP 2, Phường Trảng Dài, Thành phố Biên Hoà, Đồng Nai",Mã số thuế: 3603423307 - Đại diện pháp luật: Nguyễn Mạnh Cường,ĐN,Đồng Nai
Công Ty TNHH Taxi Trường An,"Địa chỉ: Nhà ông Nguyễn Thanh Tỏa, Đội 4, Xã Hoằng Anh, Thành phố Thanh Hoá, Thanh Hoá",Mã số thuế: 2802280605 - Đại diện pháp luật: Nguyễn Thanh Tỏa,TH,Thanh Hoá
CÔNG TY TNHH TAXI SEN HỒNG,"Địa chỉ: Số 188, ấp 1, Xã Tân Hội Trung, Huyện Cao Lãnh, Đồng Tháp",Mã số thuế: 1402040212 - Đại diện pháp luật: Nguyễn Thanh Hùng,ĐT,Đồng Tháp
Công Ty Cổ Phần Taxi Gas Sài Gòn Petrolimex,"Địa chỉ: 178/6 Điện Biên Phủ, Phường 21, Quận Bình Thạnh, TP Hồ Chí Minh",Mã số thuế: 0303527483 - Đại diện pháp luật: Tạ Thị Thu Hiền,HCM,Tp Hcm
Hợp tác xã TAXI Phú Quý,"Địa chỉ: 198 Phan Đình Phùng,, Thành phố  Pleiku, Gia Lai",Mã số thuế: 5900252954 - Đại diện pháp luật: Phùng văn Quý,GL,Gia Lai
CÔNG TY CỔ PHẦN TAXI LẠNG SƠN CHI NHÁNH CAO LỘC,"Địa chỉ: Lô 26N16, Khối 5, Thị trấn Cao Lộc, Huyện Cao Lộc, Lạng Sơn",Mã số thuế: 4900772599-001 - Đại diện pháp luật: Vũ Thị Hồng,LS,Lạng Sơn
Công Ty Cổ Phần Taxi Việt Trì Group,"Địa chỉ: Số 2835, đường Hùng Vương, Phường Vân Cơ, Thành phố Việt Trì, Phú Thọ",Mã số thuế: 2600869684 - Đại diện pháp luật: Nguyễn Thị Hương Giang,PT,Phú Thọ
Công Ty TNHH Một Thành Viên Taxi Trà Vinh,"Địa chỉ: Số 13A, Nguyễn Đáng, Khóm 1, Phường 7, Thành phố Trà Vinh, Trà Vinh",Mã số thuế: 2100510576 - Đại diện pháp luật: Trần Vĩnh Khang,TV,Trà Vinh
Chi Nhánh Công Ty Cổ Phần Sun Taxi Tại Phú Yên,"Địa chỉ: Số 01 Phan Lưu Thanh, Phường 7, TP Tuy Hoà, Phú Yên",Mã số thuế: 4201601110-002 - Đại diện pháp luật: Trần Lưu Văn,PY,Phú Yên
Công Ty TNHH Taxi Đại Hòa Phát,"Địa chỉ: Số nhà 50, Tổ 08, Đường Phạm Văn Đồng, Phường Xuân Hoà, Thị xã Phúc Yên, Vĩnh Phúc",Mã số thuế: 2500513564 - Đại diện pháp luật: Nguyễn Đình Hòa,VP,Vĩnh Phúc
Công Ty TNHH Một Thành Viên Taxi Hà Nội Bắc Ninh,"Địa chỉ: Lô A đường Lê Thái Tổ, Phường Võ Cường, Thành phố Bắc Ninh, Bắc Ninh",Mã số thuế: 2300661660 - Đại diện pháp luật: Nguyễn Văn Hưởng,BN,Bắc Ninh
CÔNG TY TNHH TM DV VT TAXI 247,"Địa chỉ: 27 Nguyễn Hữu Cầu, Phường 3, Thành Phố Vũng Tàu, Bà Rịa - Vũng Tàu",Mã số thuế: 3502423974 - Đại diện pháp luật: Hoàng Ngọc Danh,BR-VT,Bà Rịa-Vũng Tàu
HTX VẬN TẢI DU LỊCH TAXI ĐẤT THÉP,"Địa chỉ: 361A/1 Nguyễn ảnh Thủ Tổ 13 KP.1, phường Trung Mỹ Tây, Quận 12, TP Hồ Chí Minh",Mã số thuế: 0304755404 - Đại diện pháp luật: Nguyễn Hồng Khanh,HCM,Tp Hcm
