Name,Address,Tax_Code,Province_Code,Province
CÔNG TY CỔ PHẦN HANOITOURIST TAXI,"Địa chỉ: Số 105 Láng Hạ, Phường Láng Hạ, Quận Đống đa, Hà Nội",Mã số thuế: 0101745739 - Đại diện pháp luật: Nguyễn Văn Hưởng,HN,Hà Nội
Công Ty TNHH Mtv Taxi Tải Hùng Vương,"Địa chỉ: Số 90, đường Hùng Vương, Phường Chi Lăng, Thành phố Lạng Sơn, Lạng Sơn",Mã số thuế: 4900737812 - Đại diện pháp luật: Trần Tài,LS,Lạng Sơn
CÔNG TY TRÁCH NHIỆM HỮU HẠN MỘT THÀNH VIÊN TAXI BUÔN HỒ,"Địa chỉ: Số 57 đường Hùng Vương, p. An Lạc, Phường An Lạc, Thị xã Buôn Hồ, Đắk Lắk",Mã số thuế: 6001177441 - Đại diện pháp luật: Đỗ Hồng Hậu,ĐL,Đắk Lắk
Công Ty CP Taxi Bình Minh Việt Nam,"Địa chỉ: Số 217, đường Nguyễn Trãi, Phường Quán Bàu, Thành phố Vinh, Nghệ An",Mã số thuế: 2901718128 - Đại diện pháp luật: Trần Văn Minh,NA,Nghệ An
Chi Nhánh Công Ty TNHH Một Thành Viên Taxi Hậu Giang,"Địa chỉ: Tổ 1, ấp Củ Tron, Xã An Sơn, Huyện Kiên Hải, Kiên Giang",Mã số thuế: 6300139765-001 - Đại diện pháp luật: Châu Thanh Thủy,KG,Kiên Giang
Công Ty Cổ Phần Dịch Vụ Taxi Abc - Chi Nhánh Sóc Sơn,"Địa chỉ: Thôn Đoài, Xã Phú Minh, Huyện Sóc Sơn, Hà Nội",Mã số thuế: 0102239485-003 - Đại diện pháp luật: Nguyễn Hồng Hải,HN,Hà Nội
CÔNG TY TNHH TAXI ĐẮK NÔNG,"Địa chỉ: Tổ dân phố 4, Phường Nghĩa Trung, Thành phố Gia Nghĩa, Đắk Nông",Mã số thuế: 6400453157 - Đại diện pháp luật: Đỗ Xuân Quỳnh,ĐN,Đắk Nông
Công Ty TNHH 1 Thành Viên Taxi Trường Đức Thuận,"Địa chỉ: Số 12, Chu Văn An, Thị trấn Quảng Hà, Huyện Hải Hà, Quảng Ninh",Mã số thuế: 5701760953 - Đại diện pháp luật: Đinh Khắc Dũng,QN,Quảng Ninh
Công Ty Cổ Phần Taxi Đại Nam,"Địa chỉ: Số 2, Ngõ 1, Thôn Điền Xá, Xã Quang Tiến, Huyện Sóc Sơn, Hà Nội",Mã số thuế: 0104784292 - Đại diện pháp luật: Đào Thị Hải Vân,HN,Hà Nội
CÔNG TY CỔ PHẦN CÔNG NGHỆ PINGTAXI VIỆT NAM,"Địa chỉ: Tổ 45, Phường Khương Đình, Quận Thanh Xuân, Hà Nội",Mã số thuế: 0106184251 - Đại diện pháp luật: Nguyễn Thành Trung,HN,Hà Nội
Công Ty TNHH Vận Tải Thương Mại Dịch Vụ Taxi Quí Phú,"Địa chỉ: Tổ 27, Khu vực 5, Phường Đống Đa, Thành phố Quy Nhơn, Bình Định",Mã số thuế: 4101459693 - Đại diện pháp luật: Nguyễn Trần An Công,BĐ,Bình Định
CÔNG TY CỔ PHẦN TRUYỀN THÔNG TAXI CỘNG,"Địa chỉ: Nhà số 7 ngõ 46 phố Quan Nhân, Phường Trung Hoà, Quận Cầu Giấy, Hà Nội",Mã số thuế: 0105814895 - Đại diện pháp luật: Tạ Thị Kim Cúc,HN,Hà Nội
Công Ty Trách Nhiệm Hữu Hạn Taxi Thảo Nguyên,"Địa chỉ: Số 55, tiểu khu 4, Thị trấn Mộc Châu, Huyện Mộc Châu, Sơn La",Mã số thuế: 5500349711 - Đại diện pháp luật: Ngô Tiến Chiều,SL,Sơn La
HTX Vận Tải Du Lịch Taxi 12,"Địa chỉ: 319 Lê Hồng Phong, Phường 02, Quận 10, TP Hồ Chí Minh",Mã số thuế: 0301792101 - Đại diện pháp luật: Hoàng Ngọc Quang,HCM,Tp Hcm
Công Ty Cổ Phần Vận Tải Taxi Nguyễn Gia,"Địa chỉ: Tổ dân phố Trung Nghĩa 2 (nhà ông Nguyễn Văn Thông), Phường Hợp Đức, Quận Đồ Sơn, Hải Phòng",Mã số thuế: 0201728991 - Đại diện pháp luật: Nguyễn Văn Thông,HP,Hải Phòng
CÔNG TY TNHH 1TV TAXI TẢI CƯỜNG THỊNH,"Địa chỉ: 27 A Ngô Gia Tự, Phường Đông Kinh, Thành phố Lạng Sơn, Lạng Sơn",Mã số thuế: 4900316758 - Đại diện pháp luật: Lương Quốc Cường,LS,Lạng Sơn
CHI NHÁNH CÔNG TY TNHH MỘT THÀNH VIÊN TAXI PHÁT ĐẠT,"Địa chỉ: Số 105/4, ấp 10, Thị trấn Thạnh Phú, Huyện Thạnh Phú, Bến Tre",Mã số thuế: 1301011832-001 - Đại diện pháp luật: Lưu Thị Thủy,BT,Bến Tre
CTY TNHH MỘT THÀNH VIÊN TAXI TẢI NHẬT TÂN,"Địa chỉ: 121 Đinh Tiên Hoàng, P.Tự An, TP.Buôn Ma Thuột, Đắk Lắk",Mã số thuế: 6000927758 - Đại diện pháp luật: Lê Văn Tấn,ĐL,Đắk Lắk
CÔNG TY TNHH VẬN TẢI SÀI GÒN TAXI,"Địa chỉ: 845/3E Quốc lộ 1A, khu phố 3, phường An Phú Đông, Quận 12, TP Hồ Chí Minh",Mã số thuế: 0312935922 - Đại diện pháp luật: Nguyễn Tuấn Mùi,HCM,Tp Hcm
Công Ty Cổ Phần Quảng Cáo Taxi,"Địa chỉ: Tầng 46 Toà nhà Bitexco Financial Tower, Số 2 Đường Hải Triề, Phường Bến Nghé, Quận 1, TP Hồ Chí Minh",Mã số thuế: 0313714355 - Đại diện pháp luật: Nguyễn Xuân Cường,HCM,Tp Hcm
Chi Nhánh Công Ty Trách Nhiệm Hữu Hạn Taxi Tân Việt,"Địa chỉ: Số 467, tổ 10, Phường Thịnh Đán, Thành phố Thái Nguyên, Thái Nguyên",Mã số thuế: 5100344652-002 - Đại diện pháp luật: Vừ Thị Mai Hương,TN,Thái Nguyên
 Khánh Hòa  03/06/2014,"Địa chỉ: 50 Lương Thế Vinh, Phường Phước Long, Thành phố Nha Trang, Khánh Hòa","Địa chỉ: 50 Lương Thế Vinh, Phường Phước Long, Thành phố Nha Trang, Khánh Hòa",CÔNG TY CỔ PHẦN SUN TAXI,Khánh Hòa
CÔNG TY TNHH MTV TAXI HOA PHƯỢNG VÀNG,"Địa chỉ: Tổ dân phố 4, Phường Nghĩa Thành, Thành phố Gia Nghĩa, Đắk Nông",Mã số thuế: 6400452107 - Đại diện pháp luật: Nguyễn Quốc Khánh,ĐN,Đắk Nông
Công ty cổ phần Taxi hàng không Cửu Long,"Địa chỉ: Tầng 3, Trung tâm thương mại Yên Bái km4, Phường Đồng Tâm,, Tỉnh Yên Bái, Yên Bái",Mã số thuế: 5200278876 - Đại diện pháp luật: Trần Đức Anh,YB,Yên Bái
Công Ty TNHH Một Thành Viên Taxi Bạch Mã,"Địa chỉ: Khu vực 4, Thị trấn Phú Lộc, Huyện Phú Lộc, Thừa Thiên - Huế",Mã số thuế: 3301517326 - Đại diện pháp luật: Nguyễn Trịnh Hùng,TT-H,Tt Huế
Công Ty TNHH Taxi Bà Rịa,"Địa chỉ: 57 Đặng Nguyên Cẩn, Phường Long Toàn, Thành phố Bà Rịa, Bà Rịa - Vũng Tàu",Mã số thuế: 3502226863 - Đại diện pháp luật: Nguyễn Bá Nguyễn,BR-VT,Bà Rịa-Vũng Tàu
 Hà Nội  01/03/2005,"Địa chỉ: Phòng 105 D4 tổ 80 phường Dịch Vọng, Quận Cầu Giấy, Hà Nội","Địa chỉ: Phòng 105 D4 tổ 80 phường Dịch Vọng, Quận Cầu Giấy, Hà Nội",CÔNG TY TNHH TAXI VÀ XÂY DỰNG THÀNH ĐÔ,Hà Nội
CÔNG TY TNHH GO2TAXI,"Địa chỉ: 524 Lý Thường Kiệt, Phường 7, Quận Tân Bình, TP Hồ Chí Minh",Mã số thuế: 0314297217 - Đại diện pháp luật: Nguyễn Hoàng Dư,HCM,Tp Hcm
 Hà Nội  04/02/2016,"Địa chỉ: Số 31, phố Tràng Thi, Phường Hàng Trống, Quận Hoàn Kiếm, Hà Nội","Địa chỉ: Số 31, phố Tràng Thi, Phường Hàng Trống, Quận Hoàn Kiếm, Hà Nội",Công Ty Cổ Phần Taxi Nasco,Hà Nội
Doanh Nghiệp Tư Nhân TAXI Dân,"Địa chỉ: 81 Đường Trần Cao Vân,, Thành phố Quy Nhơn, Bình Định",Mã số thuế: 4100565579 - Đại diện pháp luật: Trương Thị Diệu Hằng,BĐ,Bình Định
Doanh Nghiệp Tư Nhân Taxi Hương Trà,"Địa chỉ: Tổ 22, Thị trấn Chùa Hang, Huyện Đồng Hỷ, Thái Nguyên",Mã số thuế: 4601261927 - Đại diện pháp luật: Phạm Thị Lê Hoa,TN,Thái Nguyên
Công Ty Cổ Phần Taxi Tiền Hải,"Địa chỉ: Số nhà 66, tổ 29 phố Lê Đồng, Phường âu Cơ, Thị xã Phú Thọ, Phú Thọ",Mã số thuế: 2600705703 - Đại diện pháp luật: Lê Thanh Bừng,PT,Phú Thọ
 Đắk Lắk  13/05/2009,"Địa chỉ: 369 Hùng Vương, P.An Lạc, Thị xã Buôn Hồ, Đắk Lắk","Địa chỉ: 369 Hùng Vương, P.An Lạc, Thị xã Buôn Hồ, Đắk Lắk",CN CÔNG TY TNHH TAXI BAN MÊ XANH,Đắk Lắk
Công Ty Cổ Phần Taxi Và Du Lịch Tỉnh Điện Biên,"Địa chỉ: Số nhà 12, Tổ dân phố 9, Phường Thanh Bình, TP Điện Biên Phủ, Điện Biên",Mã số thuế: 5600238130 - Đại diện pháp luật: Nguyễn Văn Lâm,ĐB,Điện Biên
CÔNG TY CỔ PHẦN BG TAXI,"Địa chỉ: Số 69 ngõ 147B phố Tân Mai, Phường Tân Mai, Quận Hoàng Mai, Hà Nội",Mã số thuế: 0102387243 - Đại diện pháp luật: Nguyễn Nhật Trung,HN,Hà Nội
CÔNG TY TNHH MỘT THÀNH VIÊN TAXI BẮC KẠN,"Địa chỉ: Tổ 8B, Phường Đức Xuân, Thành phố Bắc Kạn, Bắc Kạn",Mã số thuế: 4700202390 - Đại diện pháp luật: Nguyễn Thị Huệ,BK,Bắc Kạn
CÔNG TY CỔ PHẦN TAXI TRỰC TUYẾN,"Địa chỉ: Số 308D, phố Minh Khai, Phường Minh Khai, Quận Hai Bà Trưng, Hà Nội",Mã số thuế: 0106209481 - Đại diện pháp luật: Đinh Trọng Đỉnh,HN,Hà Nội
CôNG TY TNHH MộT THàNH VIêN TAXI THàNH CôNG THANH HóA,"Địa chỉ: Số nhà 782 Nguyễn Trãi, Phường Phú Sơn, Thành phố Thanh Hoá, Thanh Hoá",Mã số thuế: 2802417521 - Đại diện pháp luật: Nguyễn Văn Bình,TH,Thanh Hoá
CHI NHÁNH CÔNG TY CỔ PHẦN SUN TAXI TẠI ĐẮK LẮK,"Địa chỉ: Số 51 Võ Duy Thanh, Phường Tân An, TP.Buôn Ma Thuột, Đắk Lắk",Mã số thuế: 4201601110-001 - Đại diện pháp luật: Nguyễn Duy Hưng,ĐL,Đắk Lắk
Công Ty Cổ Phần Vận Tải Việt Nam Taxi,"Địa chỉ: Số 9, Tổ 4, Khu phố Khánh Hội, Phường Tân Phước Khánh, Thị xã  Tân Uyên, Bình Dương",Mã số thuế: 3702478515 - Đại diện pháp luật: Nguyễn Hữu Khoa,BD,Bình Dương
CÔNG TY CỔ PHẦN GOTAXI HÀ NỘI,"Địa chỉ: Số 2, ngõ 4  Phố Cầu Am,, Phường Vạn Phúc, Quận Hà Đông, Hà Nội",Mã số thuế: 0109143415 - Đại diện pháp luật: Nguyễn Văn Xang,HN,Hà Nội
Xí nghiệp Taxi du lịch Việt An,"Địa chỉ: số 35 đường Quang Trung,, Thành phố Vinh, Nghệ An",Mã số thuế: 2900326294-011 - Đại diện pháp luật: Lê Quang Hoà,NA,Nghệ An
CÔNG TY CỔ PHẦN TAXI LẠNG SƠN - CHI NHÁNH CHI LĂNG,"Địa chỉ: Số 322, đường Lê Lợi, khu Hòa Bình I, Thị trấn Đồng Mỏ, Huyện Chi Lăng, Lạng Sơn",Mã số thuế: 4900772599-002 - Đại diện pháp luật: Nguyễn Đức Thống,LS,Lạng Sơn
CÔNG TY CỔ PHẦN EMDDI TAXI,"Địa chỉ: Tầng 5 tòa nhà CC2 Bắc Linh Đàm, Phường Đại Kim, Quận Hoàng Mai, Hà Nội",Mã số thuế: 0110390803 - Đại diện pháp luật: Nguyễn Quốc Biên,HN,Hà Nội
Chi nhánh TAXI Quảng Trạch,"Địa chỉ: Thôn Minh Lợi , Xã Quảng Thọ,, Tỉnh Quảng Bình, Quảng Bình",Mã số thuế: 3100348389-001 - Đại diện pháp luật: Nguyễn Văn Lịch,QB,Quảng Bình
CHI NHÁNH TẠI BÀ RỊA - CÔNG TY CỔ PHẦN VẬN TẢI TAXI LONG THÀNH,"Địa chỉ: Số 229 Cách Mạng Tháng Tám, Phường Phước Hiệp, Thành phố Bà Rịa, Bà Rịa - Vũng Tàu",Mã số thuế: 3603304532-001 - Đại diện pháp luật: Phạm Minh Hiển,BR-VT,Bà Rịa-Vũng Tàu
Chi Nhánh Công Ty Cổ Phần Sun Taxi Tại Bình Định,"Địa chỉ: Số 66/02 Hàn Mặc Tử, Phường Ghềnh Ráng, Thành phố Quy Nhơn, Bình Định",Mã số thuế: 4201601110-005 - Đại diện pháp luật: Thái Anh Tuấn,BĐ,Bình Định
Công Ty TNHH Hương Trà Taxi,"Địa chỉ: Số 29 đường Tây Sơn, Phường Ghềnh Ráng, Thành phố Quy Nhơn, Bình Định",Mã số thuế: 4100667475 - Đại diện pháp luật: Phan Thị Khương,BĐ,Bình Định
CÔNG TY CỔ PHẦN TAXI CP HÀ NỘI,"Địa chỉ: Số 105 phố Láng Hạ, Phường Láng Hạ, Quận Đống đa, Hà Nội",Mã số thuế: 0100727617 - Đại diện pháp luật: Vũ Thị Việt Hồng,HN,Hà Nội
CÔNG TY TNHH GRABTAXI VIỆT NAM - CHI NHÁNH HÀ NỘI,"Địa chỉ: Số 1 tòa nhà Kim ánh, 78 ngõ Duy Tân, Phường Dịch Vọng Hậu, Quận Cầu Giấy, Hà Nội",Mã số thuế: 0313559639-001 - Đại diện pháp luật: Nguyễn Tuấn Anh,HN,Hà Nội
 Hà Nội  02/02/2010,"Địa chỉ: Thôn Thạch Bích, Xã Bích Hòa, Huyện Thanh Oai, Hà Nội","Địa chỉ: Thôn Thạch Bích, Xã Bích Hòa, Huyện Thanh Oai, Hà Nội",Công ty TNHH taxi Phương Nguyên,Hà Nội
Công Ty TNHH Một Thành Viên Taxi Sài Gòn Hoàng Long,"Địa chỉ: 149 Nguyễn Văn Cừ, Phường 02, Quận 5, TP Hồ Chí Minh",Mã số thuế: 0304934160 - Đại diện pháp luật: Phạm Phúc Toại,HCM,Tp Hcm
Công Ty TNHH  Taxi Thủy Hà,"Địa chỉ: Tổ 45, khu 4, Phường Cửa ông, Thành phố Cẩm Phả, Quảng Ninh",Mã số thuế: 5700762080 - Đại diện pháp luật: Nguyễn Thanh Thuỷ,QN,Quảng Ninh
Công Ty TNHH Grabtaxi Việt Nam,"Địa chỉ: Số 268 Tô Hiến Thành, Phường 15, Quận 10, TP Hồ Chí Minh",Mã số thuế: 0313559639 - Đại diện pháp luật: Nguyễn Tuấn Anh,HCM,Tp Hcm
Công Ty Cổ Phần Vận Tải Taxi Phù Yên,"Địa chỉ: Số nhà 42, Khối 12, Thị trấn Phù Yên, Huyện Phù Yên, Sơn La",Mã số thuế: 5500524723 - Đại diện pháp luật: Nguyễn Ngọc Văn,SL,Sơn La
CÔNG TY TNHH TAXI BÔNG SEN XANH,"Địa chỉ: Số 27 Nguyễn Huệ, Thị Trấn Phú Phong, Huyện Tây Sơn, Bình Định",Mã số thuế: 4101627193 - Đại diện pháp luật: Nguyễn Thị Huỳnh Liên,BĐ,Bình Định
CôNG TY TNHH TAXI NAM HảI - CHI NHáNH VĩNH PHúC,"Địa chỉ: Số nhà 39, Ngõ 5, Đường Tô Hiến Thành, Phường Đồng Tâm, Thành phố Vĩnh Yên, Vĩnh Phúc",Mã số thuế: 0106388745-001 - Đại diện pháp luật: Trương Thị Thu Hà,VP,Vĩnh Phúc
Công Ty TNHH  Một Thành Viên Vip Taxi,"Địa chỉ: 85B30, KDC 91B, Phường An Khánh, Quận Ninh Kiều, Cần Thơ",Mã số thuế: 1801111962 - Đại diện pháp luật: Nguyễn Thế Dũng,CT,Cần Thơ
CÔNG TY CỔ PHẦN TAXI ĐẤT QUẢNG,"Địa chỉ: Đường 104, Thôn Bích Trung, Xã Tam Xuân I, Huyện Núi Thành, Quảng Nam",Mã số thuế: 4001108638 - Đại diện pháp luật: Nguyễn Chí Linh,QN,Quảng Nam
Hợp tác xã TAXI Nha Trang,"Địa chỉ: 71A Thôn Phú Trung, Xã Vĩnh Thạnh, Thành phố Nha Trang, Khánh Hòa",Mã số thuế: 4200322675-031 - Đại diện pháp luật: Ngô Văn Lợi,KH,Khánh Hòa
Công Ty TNHH Một Thành Viên Taxi Đức Thuận,"Địa chỉ: Thôn Bắc, Xã Phú Hải, Huyện Hải Hà, Quảng Ninh",Mã số thuế: 5701515944 - Đại diện pháp luật: Nguyễn Văn Đấu,QN,Quảng Ninh
Chi Nhánh Công Ty Cổ Phần Taxi Hà Nội Quốc Tuấn,"Địa chỉ: Khu Chợ Giàn, Thôn Sài Thị, Xã Thuần Hưng, Huyện Khoái Châu, Hưng Yên",Mã số thuế: 0106801521-001 - Đại diện pháp luật: Nguyễn Thanh Bình,HY,Hưng Yên
CÔNG TY TNHH DỊCH VỤ TAXI TẢI TÍN PHÁT,"Địa chỉ: Số 20, hẻm 63/56/17, Phố Trần Quốc Vượng, Tổ 26,, Phường Dịch Vọng Hậu, Quận Cầu Giấy, Hà Nội",Mã số thuế: 0108917271 - Đại diện pháp luật: Lê Quang Đạt,HN,Hà Nội
Chi Nhánh Công Ty Cổ Phần Sun Taxi Tại Gia Lai,"Địa chỉ: 143 Lý Thái Tổ, Phường Yên Đỗ, Thành phố  Pleiku, Gia Lai",Mã số thuế: 4201601110-004 - Đại diện pháp luật: Nguyễn Duy Hưng,GL,Gia Lai
CÔNG TY TNHH TAXI GIA VIỄN,"Địa chỉ: Đường 477, xóm Hàng, Xã Gia Tân, Huyện Gia Viễn, Ninh Bình",Mã số thuế: 2700819729 - Đại diện pháp luật: Lâm Hoàng Công,NB,Ninh Bình
 Đắk Nông  19/05/2016,"Địa chỉ: Tổ dân phố 9, Thị trấn Đắk Mil, Huyện Đắk Mil, Đắk Nông","Địa chỉ: Tổ dân phố 9, Thị trấn Đắk Mil, Huyện Đắk Mil, Đắk Nông",Công Ty TNHH Một Thành Viên Taxi Đắk Mil,Đắk Nông
 Vĩnh Phúc  26/08/2015,"Địa chỉ: Xóm Phổ, Xã Quất Lưu, Huyện Bình Xuyên, Vĩnh Phúc","Địa chỉ: Xóm Phổ, Xã Quất Lưu, Huyện Bình Xuyên, Vĩnh Phúc",Chi Nhánh Công Ty Cổ Phần Taxi Phương Anh Tại Tỉnh Vĩnh Phúc,Vĩnh Phúc
CÔNG TY TNHH TAXI TẢI THUẬN PHƯỚC,"Địa chỉ: 18 Bàu Mạc 6, Phường Hoà Khánh Bắc, Quận Liên Chiểu, Đà Nẵng",Mã số thuế: 0401984061 - Đại diện pháp luật: Đới Văn Cường,ĐN,Đà Nẵng
HTX Vận Tải Du Lịch Taxi Việt Nam,"Địa chỉ: 194 Hoàng Văn Thụ P.09,, Quận Phú Nhuận, TP Hồ Chí Minh",Mã số thuế: 0302331167 - Đại diện pháp luật: Nguyễn Văn Minh,HCM,Tp Hcm
Chi Nhánh Công Ty Cổ Phần Sun Taxi Tại Bà Rịa -Vũng Tàu,"Địa chỉ: 18 Lê Hồng Phong, Phường 4, Thành Phố Vũng Tàu, Bà Rịa - Vũng Tàu",Mã số thuế: 4201601110-008 - Đại diện pháp luật: Phan Xuân Phúc,BR-VT,Bà Rịa-Vũng Tàu
Công ty TNHH MTV taxi Hoà Yến,"Địa chỉ: Thị trấn Nho Quan,, Huyện Nho quan, Ninh Bình",Mã số thuế: 2700578135 - Đại diện pháp luật: Dương Đức Hoà,NB,Ninh Bình
Công Ty TNHH Taxi Thái Mạnh,"Địa chỉ: Xóm Đoàn Kết, Xã Nghĩa Xuân, Huyện Quỳ Hợp, Nghệ An",Mã số thuế: 2901764420 - Đại diện pháp luật: Đàm Thanh Danh,NA,Nghệ An
Công Ty TNHH Vũ Long Hải Taxi Hoa Lư,"Địa chỉ: Số nhà 1017, đường Trần Hưng Đạo, Phường Vân Giang, Thành phố Ninh Bình, Ninh Bình",Mã số thuế: 2700282586 - Đại diện pháp luật: Nguyễn Ngọc Vũ,NB,Ninh Bình
CÔNG TY TNHH TỔNG ĐÀI TAXI HÀ NỘI,"Địa chỉ: Thôn Quyết Hạ, Xã Đông Sơn, Huyện Chương Mỹ, Hà Nội",Mã số thuế: 0110389942 - Đại diện pháp luật: Nguyễn Thị Lộc,HN,Hà Nội
Công Ty Cổ Phần Taxi Và Du Lịch Hoàng Gia,"Địa chỉ: Số 34 Lê Lợi, Phường Máy Tơ, Quận Ngô Quyền, Hải Phòng",Mã số thuế: 0200948923 - Đại diện pháp luật: Nguyễn Thị Loan,HP,Hải Phòng
HỢP TÁC XÃ TAXI UBER BÌNH DƯƠNG,"Địa chỉ: Thửa đất số 969, tờ bản đồ số 13, Mỹ Phước, Tân Vạn, khu 1, Phường Phú Mỹ, Thành phố Thủ Dầu Một, Bình Dương",Mã số thuế: 3702669196 - Đại diện pháp luật: Đỗ Tiến Hiếu,BD,Bình Dương
 Phú Thọ  10/04/2015,"Địa chỉ: Khu 2, Xã Sơn Thủy, Huyện Thanh Thuỷ, Phú Thọ","Địa chỉ: Khu 2, Xã Sơn Thủy, Huyện Thanh Thuỷ, Phú Thọ",Công Ty TNHH Thương Mại Và Dịch Vụ Taxi Thanh Thủy,Phú Thọ
 Hà Nội  22/09/2011,"Địa chỉ: Số 53, tổ 11, phố Vũ Xuân Thiều, Phường Sài Đồng, Quận Long Biên, Hà Nội","Địa chỉ: Số 53, tổ 11, phố Vũ Xuân Thiều, Phường Sài Đồng, Quận Long Biên, Hà Nội",Chi Nhánh Công Ty Cổ Phần Taxi Phú Thuỵ,Hà Nội
HTX Dịch Vụ Vận Tải Taxi Bến Thành,"Địa chỉ: 146 Lê Quốc Hưng P.12,, Quận 4, TP Hồ Chí Minh",Mã số thuế: 0302907450 - Đại diện pháp luật: Lê Văn Thành,HCM,Tp Hcm
Chi nhánh taxi Tiến - Công ty TNHH Thuỷ Hoàng Gia,"Địa chỉ: SN 722 Hoàng Quốc Việt, Phường Pom Hán,, Thành phố Lào Cai, Lào Cai",Mã số thuế: 0102746661-001 - Đại diện pháp luật: La Văn Du,LC,Lào Cai
CÔNG TY TNHH DỊCH VỤ TAXI LAM SƠN,"Địa chỉ: Nhà khách Tân Phú, đường Nguyễn Thị Định, Phường Tân Phú, Thành Phố Đồng Xoài, Bình Phước",Mã số thuế: 3801284510 - Đại diện pháp luật: Bùi Hữu Thọ,BP,Bình Phước
HTX Vận Tải Du Lịch Taxi Đất Thép 5,"Địa chỉ: 408 Phan Văn Trị, Phường 02, Quận 5, TP Hồ Chí Minh",Mã số thuế: 0303146015 - Đại diện pháp luật: Lê Văn Mười,HCM,Tp Hcm
Công Ty TNHH Vận Tải Taxi Vĩnh Bảo,"Địa chỉ: Thôn áng Ngoại (tại nhà ông Lại Đình Hà), Xã Trung Lập, Huyện Vĩnh Bảo, Hải Phòng",Mã số thuế: 0201292352 - Đại diện pháp luật: Lại Đình Hà,HP,Hải Phòng
CÔNG TY TNHH DỊCH VỤ TAXI ĐỒNG NHÂN THÀNH,"Địa chỉ: Đường Tản Đà, Khu Phố 7, Phường Thanh Sơn, TP. Phan Rang-Tháp Chàm, Ninh Thuận",Mã số thuế: 4500662633 - Đại diện pháp luật: Bùi Như Long,NT,Ninh Thuận
CÔNG TY TNHH TAXI GAS PETROLIMEX HÀ NỘI,"Địa chỉ: Số 775 đường Giải Phóng, phường Giáp Bát, Quận Hoàng Mai, Hà Nội",Mã số thuế: 0101529135 - Đại diện pháp luật: Công ty CP gas Petrolimex,HN,Hà Nội
 Thanh Hoá  16/05/2014,"Địa chỉ: Thôn 6, Xã Hoằng Ngọc, Huyện Hoằng Hoá, Thanh Hoá","Địa chỉ: Thôn 6, Xã Hoằng Ngọc, Huyện Hoằng Hoá, Thanh Hoá",Công Ty TNHH Taxi Hải Tiến,Thanh Hoá
Công Ty TNHH Một Thành Viên Taxi Thành Công Nha Trang,"Địa chỉ: 01 hẻm 14 Tổ 12 đường Hòa Trung, Phường Vĩnh Hoà, Thành phố Nha Trang, Khánh Hòa",Mã số thuế: 4201672111 - Đại diện pháp luật: Nguyễn Huy Văn,KH,Khánh Hòa
Công Ty Cổ Phần Taxi Jac,"Địa chỉ: Tổ 5, Phường Tân Long, Thành phố Thái Nguyên, Thái Nguyên",Mã số thuế: 4601107393 - Đại diện pháp luật: Nguyễn Quang Trung,TN,Thái Nguyên
CHI NHÁNH CÔNG TY CỔ PHẦN SUN TAXI TẠI ĐỒNG NAI,"Địa chỉ: 731, đường Bùi Văn Hòa, KP7, Phường Long Bình, Thành phố Biên Hoà, Đồng Nai",Mã số thuế: 4201601110-003 - Đại diện pháp luật: Phạm Công Huấn,ĐN,Đồng Nai
Công Ty TNHH Một Thành Viên Taxi Minh Hiển,"Địa chỉ: Số 349, ấp 5, Xã An Phước, Huyện Long Thành, Đồng Nai",Mã số thuế: 3603304532 - Đại diện pháp luật: Phạm Minh Hiển,ĐN,Đồng Nai
 Hà Nội  05/10/2004,"Địa chỉ: Số 105, phố Láng Hạ, Phường Láng Hạ, Quận Đống đa, Hà Nội","Địa chỉ: Số 105, phố Láng Hạ, Phường Láng Hạ, Quận Đống đa, Hà Nội",CÔNG TY CỔ PHẦN TAXI HÀ NỘI,Hà Nội
Công Ty Cổ Phần Taxi Sông Vân Ninh Bình,"Địa chỉ: 570, Phố Đoàn Kết, Phường Ninh Phong, Thành phố Ninh Bình, Ninh Bình",Mã số thuế: 2700790068 - Đại diện pháp luật: Bùi Xuân Lộc,NB,Ninh Bình
DNTN TAXI Phương Duy,"Địa chỉ: Quốc lộ 30, xã An Bình A,, Thị xã Hồng Ngự, Đồng Tháp",Mã số thuế: 1401056442 - Đại diện pháp luật: Lê Văn Phương,ĐT,Đồng Tháp
Chi Nhánh Công Ty TNHH Một Thành Viên Taxi Sài Gòn Hoàng Long Tại Phú Quốc,"Địa chỉ: Số 164A đường 30/4, khu phố 1, Thị trấn Dương Đông, Huyện Phú Quốc, Kiên Giang",Mã số thuế: 0304934160-005 - Đại diện pháp luật: Phan Văn Phong,KG,Kiên Giang
Công Ty TNHH 1 Thành Viên Taxi Hoàng Yến,"Địa chỉ: Tổ 6, khu 4, Phường Yết Kiêu, Thành phố Hạ Long, Quảng Ninh",Mã số thuế: 5701516786 - Đại diện pháp luật: Vũ Thị Lan,QN,Quảng Ninh
Công Ty Cổ Phần Vận Tải Taxi Phú Thành,"Địa chỉ: Khối phố 6, Phường Đại Nài, Thành phố Hà Tĩnh, Hà Tĩnh",Mã số thuế: 3001654240 - Đại diện pháp luật: Nguyễn Văn Vinh,HT,Hà Tĩnh
Công Ty Cổ Phần Taxi Trung Thành,"Địa chỉ: Số 278 Nguyễn Văn Linh, Phường Dư Hàng Kênh, Quận Lê Chân, Hải Phòng",Mã số thuế: 0200991566 - Đại diện pháp luật: Đỗ Văn Ngọc,HP,Hải Phòng
 Quảng Nam  20/04/1999,"Địa chỉ: 495B Phan Chu Trinh, Phước Hòa,, Thành phố Tam Kỳ, Quảng Nam","Địa chỉ: 495B Phan Chu Trinh, Phước Hòa,, Thành phố Tam Kỳ, Quảng Nam",Trạm điều hành xe Taxi Tam Kỳ,Quảng Nam
CÔNG TY CỔ PHẦN TAXI SAO MAI,"Địa chỉ: Số 311, đường Lê Lợi, Phường Yết Kiêu, Thành phố Hạ Long, Quảng Ninh",Mã số thuế: 5700669564 - Đại diện pháp luật: Vũ Việt Thư,QN,Quảng Ninh
Chi nhánh trung tâm  taxi Hoàng Hà,"Địa chỉ: SN 023 Đường Hoàng Diệu Phường Phố Mới,, Thành phố Lào Cai, Lào Cai",Mã số thuế: 5300212413-003 - Đại diện pháp luật: Nguyễn Văn Hoà,LC,Lào Cai
 Hà Nội  16/06/2023,"Địa chỉ: Thôn Thanh Vân, Xã Thanh Lâm, Huyện Mê Linh, Hà Nội","Địa chỉ: Thôn Thanh Vân, Xã Thanh Lâm, Huyện Mê Linh, Hà Nội",CÔNG TY TNHH ĐẶT XE TAXI HÀ NỘI,Hà Nội
Công Ty Trách Nhiệm Hữu Hạn Một Thành Viên Taxi Gia Đình,"Địa chỉ: Số 238, đường Bà Triệu, khóm 6, Phường 3, Thành Phố Bạc Liêu, Bạc Liêu",Mã số thuế: 1900459133 - Đại diện pháp luật: Huỳnh Minh Hải,BL,Bạc Liêu
CÔNG TY TNHH TAXI NỘI BÀI,"Địa chỉ: Km 9+400, Quốc Lộ 2, Thôn Thạch Lỗi, Xã Thanh Xuân, Huyện Sóc Sơn, Hà Nội",Mã số thuế: 0110478889 - Đại diện pháp luật: Tạ Minh Ngọc,HN,Hà Nội
Chi Nhánh Công Ty Cổ Phần Suntaxi Tại Kon Tum,"Địa chỉ: Số nhà 248, Đường Đống Đa, Phường Quang Trung, Thành phố Kon Tum, Kon Tum",Mã số thuế: 4201601110-006 - Đại diện pháp luật: Nguyễn Duy Hưng,KT,Kon Tum
Công Ty TNHH Taxi Đạt Hùng,"Địa chỉ: Thôn Đông Sơn, Xã Đông Xá, Huyện Vân Đồn, Quảng Ninh",Mã số thuế: 5700511136 - Đại diện pháp luật: Phạm  Văn Mạnh,QN,Quảng Ninh
 Bắc Giang  31/07/2008,"Địa chỉ: thôn ổi, xã Nghĩa Hồ,, Huyện Lục Ngạn, Bắc Giang","Địa chỉ: thôn ổi, xã Nghĩa Hồ,, Huyện Lục Ngạn, Bắc Giang",Công ty TNHH Taxi Thịnh Vượng,Bắc Giang
Công ty TNHH Taxi Phong Lộc,"Địa chỉ: 268 đường Minh Khai, phường Vị Hoàng,, Thành phố Nam Định, Nam Định",Mã số thuế: 0600646606 - Đại diện pháp luật: Trần Thị Vân Anh,NĐ,Nam Định
